name, appearance, feel, smell
"Sweater", "It's a blue sweater that had the number 12 stitched on it.", "Someone has unstitched the second number, leaving only the 1", "The sweater smells of laundry detergent."
"Chair", "It's a wooden chair with only 3 legs.", "Someone had deliberatly snapped off one of the legs.", "It smells like old wood."
"Journal", "The final entry states that the time should be hours then minutes then seconds (H-M-S).", "The cover is worn and several pages are missing.", "It smells like musty leather."
"Bowl of soup", "It appears to be tomato soup.", "It has cooled down to room temerature.", "You detect 7 different herbs and spices."
"Clock", "The hour hand is pointing towards the soup, the minute hand towards the chair, and the second hand towards the sweater.", "The battery compartment is open and empty.", "It smells of plactic."